[
  {"id": "chilla", "names": {"en": "Chilla", "hi": "चीला"}, "aliases": ["Besan chilla", "Gram flour pancake"], "states": ["chhattisgarh", "madhya-pradesh", "uttar-pradesh"], "category": "breakfast", "serving_g": 100, "nutrition": {"calories": 160, "protein": 6.0, "carbs": 25.0, "fat": 4.0, "fiber": 3.0}, "metadata": {"source": "Institutional", "source_reference": "Regional Study", "source_reliability": "community"}},
  {"id": "fara", "names": {"en": "Fara", "hi": "फरा"}, "aliases": ["Rice flour dumplings"], "states": ["chhattisgarh"], "category": "breakfast", "serving_g": 150, "nutrition": {"calories": 200, "protein": 4.0, "carbs": 40.0, "fat": 2.0, "fiber": 2.0}, "metadata": {"source": "Institutional", "source_reference": "Regional Study", "source_reliability": "community"}},
  {"id": "angakar-roti", "names": {"en": "Angakar Roti", "hi": "अंगाकर रोटी"}, "aliases": ["Wheat flatbread"], "states": ["chhattisgarh"], "category": "main", "serving_g": 100, "nutrition": {"calories": 250, "protein": 5.0, "carbs": 45.0, "fat": 5.0, "fiber": 3.0}, "metadata": {"source": "Institutional", "source_reference": "Regional Study", "source_reliability": "community"}},
  {"id": "muthiya", "names": {"en": "Muthiya", "hi": "मुठिया"}, "aliases": ["Steamed dumpling"], "states": ["chhattisgarh"], "category": "snack", "serving_g": 100, "nutrition": {"calories": 180, "protein": 3.0, "carbs": 35.0, "fat": 2.0, "fiber": 2.0}, "metadata": {"source": "Institutional", "source_reference": "Regional Study", "source_reliability": "community"}},
  {"id": "bafauri", "names": {"en": "Bafauri", "hi": "बफौरी"}, "aliases": ["Steamed gram flour cake"], "states": ["chhattisgarh"], "category": "snack", "serving_g": 100, "nutrition": {"calories": 190, "protein": 7.0, "carbs": 30.0, "fat": 4.0, "fiber": 3.0}, "metadata": {"source": "Institutional", "source_reference": "Regional Study", "source_reliability": "community"}},
  {"id": "hat-phod", "names": {"en": "Hat Phod", "hi": "हथफोड़"}, "aliases": ["Spiced vegetable"], "states": ["chhattisgarh"], "category": "side", "serving_g": 100, "nutrition": {"calories": 70, "protein": 1.5, "carbs": 12.0, "fat": 2.0, "fiber": 3.0}, "metadata": {"source": "Institutional", "source_reference": "Regional Study", "source_reliability": "community"}},
  {"id": "chousela", "names": {"en": "Chousela", "hi": "चौसेला"}, "aliases": ["Rice flour fried bread"], "states": ["chhattisgarh"], "category": "breakfast", "serving_g": 100, "nutrition": {"calories": 320, "protein": 4.0, "carbs": 45.0, "fat": 14.0, "fiber": 1.5}, "metadata": {"source": "Institutional", "source_reference": "Regional Study", "source_reliability": "community"}},
  {"id": "amat", "names": {"en": "Amat", "hi": "अमत"}, "aliases": ["Bamboo shoot curry"], "states": ["chhattisgarh"], "category": "side", "serving_g": 150, "nutrition": {"calories": 80, "protein": 2.0, "carbs": 10.0, "fat": 2.5, "fiber": 3.0}, "metadata": {"source": "Institutional", "source_reference": "Regional Study", "source_reliability": "community"}},
  {"id": "til-gur", "names": {"en": "Til Gur", "hi": "तिल गुड़"}, "aliases": ["Sesame Jaggery sweet"], "states": ["chhattisgarh"], "category": "dessert", "serving_g": 50, "nutrition": {"calories": 240, "protein": 3.5, "carbs": 30.0, "fat": 12.0, "fiber": 2.0}, "metadata": {"source": "Institutional", "source_reference": "Regional Study", "source_reliability": "community"}},
  {"id": "petha", "names": {"en": "Petha", "hi": "पेठा"}, "aliases": ["Ash gourd sweet"], "states": ["chhattisgarh"], "category": "dessert", "serving_g": 50, "nutrition": {"calories": 190, "protein": 0.5, "carbs": 45.0, "fat": 0.5, "fiber": 0.5}, "metadata": {"source": "Institutional", "source_reference": "Regional Study", "source_reliability": "community"}},
  {"id": "khurma", "names": {"en": "Khurma", "hi": "खुरमा"}, "aliases": ["Sweet snack"], "states": ["chhattisgarh"], "category": "snack", "serving_g": 50, "nutrition": {"calories": 220, "protein": 3.0, "carbs": 35.0, "fat": 8.0, "fiber": 1.0}, "metadata": {"source": "Institutional", "source_reference": "Regional Study", "source_reliability": "community"}},
  {"id": "dudh-fara", "names": {"en": "Dudh Fara", "hi": "दूध फरा"}, "aliases": ["Fara in milk"], "states": ["chhattisgarh"], "category": "dessert", "serving_g": 200, "nutrition": {"calories": 280, "protein": 6.0, "carbs": 45.0, "fat": 8.0, "fiber": 2.0}, "metadata": {"source": "Institutional", "source_reference": "Regional Study", "source_reliability": "community"}},
  {"id": "aamat", "names": {"en": "Aamat", "hi": "अमत"}, "aliases": ["Bamboo curry"], "states": ["chhattisgarh"], "category": "side", "serving_g": 100, "nutrition": {"calories": 60, "protein": 1.5, "carbs": 8.0, "fat": 2.0, "fiber": 2.0}, "metadata": {"source": "Institutional", "source_reference": "Regional Study", "source_reliability": "community"}},
  {"id": "bidiya", "names": {"en": "Bidiya", "hi": "बिदिया"}, "aliases": ["Spiced vegetable"], "states": ["chhattisgarh"], "category": "side", "serving_g": 100, "nutrition": {"calories": 90, "protein": 2.0, "carbs": 15.0, "fat": 2.0, "fiber": 3.0}, "metadata": {"source": "Institutional", "source_reference": "Regional Study", "source_reliability": "community"}},
  {"id": "kanda-bhaji", "names": {"en": "Kanda Bhaji", "hi": "कांदा भाजी"}, "aliases": ["Onion greens"], "states": ["chhattisgarh"], "category": "side", "serving_g": 100, "nutrition": {"calories": 40, "protein": 1.5, "carbs": 8.0, "fat": 0.5, "fiber": 2.0}, "metadata": {"source": "Institutional", "source_reference": "Regional Study", "source_reliability": "community"}},
  {"id": "tikhur", "names": {"en": "Tikhur", "hi": "तिखुर"}, "aliases": ["Arrowroot sweet"], "states": ["chhattisgarh"], "category": "dessert", "serving_g": 100, "nutrition": {"calories": 280, "protein": 0.5, "carbs": 65.0, "fat": 0.2, "fiber": 1.0}, "metadata": {"source": "Institutional", "source_reference": "Regional Study", "source_reliability": "community"}},
  {"id": "lal-bhaji", "names": {"en": "Lal Bhaji", "hi": "लाल भाजी"}, "aliases": ["Red spinach"], "states": ["chhattisgarh"], "category": "side", "serving_g": 100, "nutrition": {"calories": 30, "protein": 2.0, "carbs": 5.0, "fat": 0.5, "fiber": 3.0}, "metadata": {"source": "Institutional", "source_reference": "Regional Study", "source_reliability": "community"}},
  {"id": "chawal-roti", "names": {"en": "Chawal Roti", "hi": "चावल रोटी"}, "aliases": ["Rice flour flatbread"], "states": ["chhattisgarh"], "category": "main", "serving_g": 100, "nutrition": {"calories": 230, "protein": 4.0, "carbs": 45.0, "fat": 2.0, "fiber": 2.0}, "metadata": {"source": "Institutional", "source_reference": "Regional Study", "source_reliability": "community"}},
  {"id": "fara-chana", "names": {"en": "Fara Chana", "hi": "फरा चना"}, "aliases": ["Fara side"], "states": ["chhattisgarh"], "category": "breakfast", "serving_g": 150, "nutrition": {"calories": 240, "protein": 7.0, "carbs": 42.0, "fat": 3.0, "fiber": 4.0}, "metadata": {"source": "Institutional", "source_reference": "Regional Study", "source_reliability": "community"}},
  {"id": "angakar-roti-side", "names": {"en": "Angakar Roti Side", "hi": "अंगाकर रोटी"}, "aliases": ["Side"], "states": ["chhattisgarh"], "category": "main", "serving_g": 50, "nutrition": {"calories": 125, "protein": 2.5, "carbs": 22.5, "fat": 2.5, "fiber": 1.5}, "metadata": {"source": "Institutional", "source_reference": "Regional Study", "source_reliability": "community"}}
]
