[
  {"id": "rogan-josh", "names": {"en": "Rogan Josh", "ks": "रोगन जोश"}, "aliases": ["Spiced mutton curry"], "states": ["jammu-kashmir"], "category": "main", "serving_g": 200, "nutrition": {"calories": 300, "protein": 20.0, "carbs": 5.0, "fat": 20.0, "fiber": 1.0}, "metadata": {"source": "Institutional", "source_reference": "Regional Study", "source_reliability": "community"}},
  {"id": "dum-aloo-jk", "names": {"en": "Kashmiri Dum Aloo", "ks": "दम आलू"}, "aliases": ["Spiced potato curry"], "states": ["jammu-kashmir"], "category": "side", "serving_g": 150, "nutrition": {"calories": 180, "protein": 2.0, "carbs": 25.0, "fat": 8.0, "fiber": 3.0}, "metadata": {"source": "Institutional", "source_reference": "Regional Study", "source_reliability": "community"}},
  {"id": "kahwa", "names": {"en": "Kahwa", "ks": "कहवा"}, "aliases": ["Kashmiri tea"], "states": ["jammu-kashmir"], "category": "breakfast", "serving_g": 150, "nutrition": {"calories": 40, "protein": 0.5, "carbs": 10.0, "fat": 0.0, "fiber": 0.0}, "metadata": {"source": "Institutional", "source_reference": "Regional Study", "source_reliability": "community"}},
  {"id": "gushtaba", "names": {"en": "Gushtaba", "ks": "गुश्ताबा"}, "aliases": ["Mutton meatball curry"], "states": ["jammu-kashmir"], "category": "main", "serving_g": 200, "nutrition": {"calories": 350, "protein": 25.0, "carbs": 5.0, "fat": 25.0, "fiber": 0.5}, "metadata": {"source": "Institutional", "source_reference": "Regional Study", "source_reliability": "community"}},
  {"id": "yakhni", "names": {"en": "Yakhni", "ks": "यखनी"}, "aliases": ["Yogurt mutton curry"], "states": ["jammu-kashmir"], "category": "main", "serving_g": 200, "nutrition": {"calories": 250, "protein": 18.0, "carbs": 5.0, "fat": 18.0, "fiber": 0.5}, "metadata": {"source": "Institutional", "source_reference": "Regional Study", "source_reliability": "community"}},
  {"id": "tabak-maz", "names": {"en": "Tabak Maz", "ks": "तबाक माज"}, "aliases": ["Fried mutton ribs"], "states": ["jammu-kashmir"], "category": "snack", "serving_g": 100, "nutrition": {"calories": 400, "protein": 25.0, "carbs": 2.0, "fat": 32.0, "fiber": 0.0}, "metadata": {"source": "Institutional", "source_reference": "Regional Study", "source_reliability": "community"}},
  {"id": "modur-pulav", "names": {"en": "Modur Pulav", "ks": "मोदुर पुलाव"}, "aliases": ["Sweetened rice"], "states": ["jammu-kashmir"], "category": "main", "serving_g": 200, "nutrition": {"calories": 280, "protein": 3.0, "carbs": 50.0, "fat": 7.0, "fiber": 1.0}, "metadata": {"source": "Institutional", "source_reference": "Regional Study", "source_reliability": "community"}},
  {"id": "rogan-josh-main", "names": {"en": "Rogan Josh Main", "ks": "रोगन जोश"}, "aliases": ["Main"], "states": ["jammu-kashmir"], "category": "main", "serving_g": 100, "nutrition": {"calories": 150, "protein": 10.0, "carbs": 2.5, "fat": 10.0, "fiber": 0.5}, "metadata": {"source": "Institutional", "source_reference": "Regional Study", "source_reliability": "community"}},
  {"id": "dum-aloo-jk-side", "names": {"en": "Dum Aloo Side", "ks": "दम आलू"}, "aliases": ["Side"], "states": ["jammu-kashmir"], "category": "side", "serving_g": 75, "nutrition": {"calories": 90, "protein": 1.0, "carbs": 12.5, "fat": 4.0, "fiber": 1.5}, "metadata": {"source": "Institutional", "source_reference": "Regional Study", "source_reliability": "community"}},
  {"id": "kahwa-drink", "names": {"en": "Kahwa Drink", "ks": "कहवा"}, "aliases": ["Drink"], "states": ["jammu-kashmir"], "category": "breakfast", "serving_g": 75, "nutrition": {"calories": 20, "protein": 0.25, "carbs": 5.0, "fat": 0.0, "fiber": 0.0}, "metadata": {"source": "Institutional", "source_reference": "Regional Study", "source_reliability": "community"}},
  {"id": "gushtaba-main", "names": {"en": "Gushtaba Main", "ks": "गुश्ताबा"}, "aliases": ["Main"], "states": ["jammu-kashmir"], "category": "main", "serving_g": 100, "nutrition": {"calories": 175, "protein": 12.5, "carbs": 2.5, "fat": 12.5, "fiber": 0.25}, "metadata": {"source": "Institutional", "source_reference": "Regional Study", "source_reliability": "community"}},
  {"id": "yakhni-main", "names": {"en": "Yakhni Main", "ks": "यखनी"}, "aliases": ["Main"], "states": ["jammu-kashmir"], "category": "main", "serving_g": 100, "nutrition": {"calories": 125, "protein": 9.0, "carbs": 2.5, "fat": 9.0, "fiber": 0.25}, "metadata": {"source": "Institutional", "source_reference": "Regional Study", "source_reliability": "community"}},
  {"id": "tabak-maz-snack", "names": {"en": "Tabak Maz Snack", "ks": "तबाक माज"}, "aliases": ["Snack"], "states": ["jammu-kashmir"], "category": "snack", "serving_g": 50, "nutrition": {"calories": 200, "protein": 12.5, "carbs": 1.0, "fat": 16.0, "fiber": 0.0}, "metadata": {"source": "Institutional", "source_reference": "Regional Study", "source_reliability": "community"}},
  {"id": "modur-pulav-main", "names": {"en": "Modur Pulav Main", "ks": "मोदुर पुलाव"}, "aliases": ["Main"], "states": ["jammu-kashmir"], "category": "main", "serving_g": 100, "nutrition": {"calories": 140, "protein": 1.5, "carbs": 25.0, "fat": 3.5, "fiber": 0.5}, "metadata": {"source": "Institutional", "source_reference": "Regional Study", "source_reliability": "community"}},
  {"id": "rogan-josh-main2", "names": {"en": "Rogan Josh Main2", "ks": "रोगन जोश"}, "aliases": ["Main"], "states": ["jammu-kashmir"], "category": "main", "serving_g": 50, "nutrition": {"calories": 75, "protein": 5.0, "carbs": 1.25, "fat": 5.0, "fiber": 0.25}, "metadata": {"source": "Institutional", "source_reference": "Regional Study", "source_reliability": "community"}},
  {"id": "dum-aloo-jk-side2", "names": {"en": "Dum Aloo Side2", "ks": "दम आलू"}, "aliases": ["Side"], "states": ["jammu-kashmir"], "category": "side", "serving_g": 37.5, "nutrition": {"calories": 45, "protein": 0.5, "carbs": 6.25, "fat": 2.0, "fiber": 0.75}, "metadata": {"source": "Institutional", "source_reference": "Regional Study", "source_reliability": "community"}},
  {"id": "gushtaba-main2", "names": {"en": "Gushtaba Main2", "ks": "गुश्ताबा"}, "aliases": ["Main"], "states": ["jammu-kashmir"], "category": "main", "serving_g": 50, "nutrition": {"calories": 87.5, "protein": 6.25, "carbs": 1.25, "fat": 6.25, "fiber": 0.125}, "metadata": {"source": "Institutional", "source_reference": "Regional Study", "source_reliability": "community"}},
  {"id": "yakhni-main2", "names": {"en": "Yakhni Main2", "ks": "यखनी"}, "aliases": ["Main"], "states": ["jammu-kashmir"], "category": "main", "serving_g": 50, "nutrition": {"calories": 62.5, "protein": 4.5, "carbs": 1.25, "fat": 4.5, "fiber": 0.125}, "metadata": {"source": "Institutional", "source_reference": "Regional Study", "source_reliability": "community"}},
  {"id": "tabak-maz-snack2", "names": {"en": "Tabak Maz Snack2", "ks": "तबाक माज"}, "aliases": ["Snack"], "states": ["jammu-kashmir"], "category": "snack", "serving_g": 25, "nutrition": {"calories": 100, "protein": 6.25, "carbs": 0.5, "fat": 8.0, "fiber": 0.0}, "metadata": {"source": "Institutional", "source_reference": "Regional Study", "source_reliability": "community"}},
  {"id": "modur-pulav-main2", "names": {"en": "Modur Pulav Main2", "ks": "मोदुर पुलाव"}, "aliases": ["Main"], "states": ["jammu-kashmir"], "category": "main", "serving_g": 50, "nutrition": {"calories": 70, "protein": 0.75, "carbs": 12.5, "fat": 1.75, "fiber": 0.25}, "metadata": {"source": "Institutional", "source_reference": "Regional Study", "source_reliability": "community"}}
]
