[
  {"id": "shukto", "names": {"en": "Shukto", "bn": "শুক্তো"}, "aliases": ["Mixed vegetable dish"], "states": ["west-bengal"], "category": "side", "serving_g": 150, "nutrition": {"calories": 80, "protein": 2.0, "carbs": 12.0, "fat": 2.5, "fiber": 3.0}, "metadata": {"source": "Institutional", "source_reference": "Regional Study", "source_reliability": "community"}},
  {"id": "macher-jhol", "names": {"en": "Macher Jhol", "bn": "মাছের ঝোল"}, "aliases": ["Fish curry"], "states": ["west-bengal"], "category": "main", "serving_g": 200, "nutrition": {"calories": 160, "protein": 18.0, "carbs": 5.0, "fat": 8.0, "fiber": 0.5}, "metadata": {"source": "Institutional", "source_reference": "Regional Study", "source_reliability": "community"}},
  {"id": "mishti-doi", "names": {"en": "Mishti Doi", "bn": "মিষ্টি দই"}, "aliases": ["Sweet yogurt"], "states": ["west-bengal"], "category": "dessert", "serving_g": 100, "nutrition": {"calories": 150, "protein": 4.0, "carbs": 25.0, "fat": 4.0, "fiber": 0.0}, "metadata": {"source": "Institutional", "source_reference": "Regional Study", "source_reliability": "community"}},
  {"id": "sandesh", "names": {"en": "Sandesh", "bn": "সন্দেশ"}, "aliases": ["Milk sweet"], "states": ["west-bengal"], "category": "dessert", "serving_g": 50, "nutrition": {"calories": 180, "protein": 5.0, "carbs": 25.0, "fat": 7.0, "fiber": 0.1}, "metadata": {"source": "Institutional", "source_reference": "Regional Study", "source_reliability": "community"}},
  {"id": "kosha-mangsho", "names": {"en": "Kosha Mangsho", "bn": "কষা মাংস"}, "aliases": ["Spiced mutton curry"], "states": ["west-bengal"], "category": "main", "serving_g": 200, "nutrition": {"calories": 350, "protein": 20.0, "carbs": 6.0, "fat": 25.0, "fiber": 1.0}, "metadata": {"source": "Institutional", "source_reference": "Regional Study", "source_reliability": "community"}},
  {"id": "aloo-posto", "names": {"en": "Aloo Posto", "bn": "আলু পোস্ত"}, "aliases": ["Potato in poppy seed paste"], "states": ["west-bengal"], "category": "side", "serving_g": 150, "nutrition": {"calories": 140, "protein": 3.0, "carbs": 20.0, "fat": 5.0, "fiber": 4.0}, "metadata": {"source": "Institutional", "source_reference": "Regional Study", "source_reliability": "community"}},
  {"id": "beguni", "names": {"en": "Beguni", "bn": "বেগুনী"}, "aliases": ["Eggplant fritter"], "states": ["west-bengal"], "category": "snack", "serving_g": 50, "nutrition": {"calories": 150, "protein": 1.5, "carbs": 12.0, "fat": 10.0, "fiber": 1.5}, "metadata": {"source": "Institutional", "source_reference": "Regional Study", "source_reliability": "community"}},
  {"id": "luchi", "names": {"en": "Luchi", "bn": "লুচি"}, "aliases": ["Deep fried flatbread"], "states": ["west-bengal"], "category": "breakfast", "serving_g": 50, "nutrition": {"calories": 180, "protein": 3.0, "carbs": 25.0, "fat": 8.0, "fiber": 1.0}, "metadata": {"source": "Institutional", "source_reference": "Regional Study", "source_reliability": "community"}},
  {"id": "shukto-side", "names": {"en": "Shukto Side", "bn": "শুক্তো"}, "aliases": ["Side"], "states": ["west-bengal"], "category": "side", "serving_g": 75, "nutrition": {"calories": 40, "protein": 1.0, "carbs": 6.0, "fat": 1.25, "fiber": 1.5}, "metadata": {"source": "Institutional", "source_reference": "Regional Study", "source_reliability": "community"}},
  {"id": "macher-jhol-main", "names": {"en": "Macher Jhol Main", "bn": "মাছের ঝোল"}, "aliases": ["Main"], "states": ["west-bengal"], "category": "main", "serving_g": 100, "nutrition": {"calories": 80, "protein": 9.0, "carbs": 2.5, "fat": 4.0, "fiber": 0.25}, "metadata": {"source": "Institutional", "source_reference": "Regional Study", "source_reliability": "community"}},
  {"id": "mishti-doi-dessert", "names": {"en": "Mishti Doi Dessert", "bn": "মিষ্টি দই"}, "aliases": ["Dessert"], "states": ["west-bengal"], "category": "dessert", "serving_g": 50, "nutrition": {"calories": 75, "protein": 2.0, "carbs": 12.5, "fat": 2.0, "fiber": 0.0}, "metadata": {"source": "Institutional", "source_reference": "Regional Study", "source_reliability": "community"}},
  {"id": "sandesh-dessert", "names": {"en": "Sandesh Dessert", "bn": "সন্দেশ"}, "aliases": ["Dessert"], "states": ["west-bengal"], "category": "dessert", "serving_g": 25, "nutrition": {"calories": 90, "protein": 2.5, "carbs": 12.5, "fat": 3.5, "fiber": 0.05}, "metadata": {"source": "Institutional", "source_reference": "Regional Study", "source_reliability": "community"}},
  {"id": "kosha-mangsho-main", "names": {"en": "Kosha Mangsho Main", "bn": "কষা মাংস"}, "aliases": ["Main"], "states": ["west-bengal"], "category": "main", "serving_g": 100, "nutrition": {"calories": 175, "protein": 10.0, "carbs": 3.0, "fat": 12.5, "fiber": 0.5}, "metadata": {"source": "Institutional", "source_reference": "Regional Study", "source_reliability": "community"}},
  {"id": "aloo-posto-side", "names": {"en": "Aloo Posto Side", "bn": "আলু পোস্ত"}, "aliases": ["Side"], "states": ["west-bengal"], "category": "side", "serving_g": 75, "nutrition": {"calories": 70, "protein": 1.5, "carbs": 10.0, "fat": 2.5, "fiber": 2.0}, "metadata": {"source": "Institutional", "source_reference": "Regional Study", "source_reliability": "community"}},
  {"id": "beguni-snack", "names": {"en": "Beguni Snack", "bn": "বেগুনী"}, "aliases": ["Snack"], "states": ["west-bengal"], "category": "snack", "serving_g": 25, "nutrition": {"calories": 75, "protein": 0.75, "carbs": 6.0, "fat": 5.0, "fiber": 0.75}, "metadata": {"source": "Institutional", "source_reference": "Regional Study", "source_reliability": "community"}},
  {"id": "luchi-breakfast", "names": {"en": "Luchi Breakfast", "bn": "লুচি"}, "aliases": ["Breakfast"], "states": ["west-bengal"], "category": "breakfast", "serving_g": 25, "nutrition": {"calories": 90, "protein": 1.5, "carbs": 12.5, "fat": 4.0, "fiber": 0.5}, "metadata": {"source": "Institutional", "source_reference": "Regional Study", "source_reliability": "community"}},
  {"id": "shukto-side2", "names": {"en": "Shukto Side2", "bn": "শুক্তো"}, "aliases": ["Side"], "states": ["west-bengal"], "category": "side", "serving_g": 75, "nutrition": {"calories": 40, "protein": 1.0, "carbs": 6.0, "fat": 1.25, "fiber": 1.5}, "metadata": {"source": "Institutional", "source_reference": "Regional Study", "source_reliability": "community"}},
  {"id": "macher-jhol-main2", "names": {"en": "Macher Jhol Main2", "bn": "মাছের ঝোল"}, "aliases": ["Main"], "states": ["west-bengal"], "category": "main", "serving_g": 100, "nutrition": {"calories": 80, "protein": 9.0, "carbs": 2.5, "fat": 4.0, "fiber": 0.25}, "metadata": {"source": "Institutional", "source_reference": "Regional Study", "source_reliability": "community"}},
  {"id": "mishti-doi-dessert2", "names": {"en": "Mishti Doi Dessert2", "bn": "মিষ্টি দই"}, "aliases": ["Dessert"], "states": ["west-bengal"], "category": "dessert", "serving_g": 50, "nutrition": {"calories": 75, "protein": 2.0, "carbs": 12.5, "fat": 2.0, "fiber": 0.0}, "metadata": {"source": "Institutional", "source_reference": "Regional Study", "source_reliability": "community"}},
  {"id": "sandesh-dessert2", "names": {"en": "Sandesh Dessert2", "bn": "সন্দেশ"}, "aliases": ["Dessert"], "states": ["west-bengal"], "category": "dessert", "serving_g": 25, "nutrition": {"calories": 90, "protein": 2.5, "carbs": 12.5, "fat": 3.5, "fiber": 0.05}, "metadata": {"source": "Institutional", "source_reference": "Regional Study", "source_reliability": "community"}}
]
