[
  {"id": "eromba", "names": {"en": "Eromba", "mni": "ইরোম্বা"}, "aliases": ["Fermented fish and veggie mash"], "states": ["manipur"], "category": "side", "serving_g": 100, "nutrition": {"calories": 80, "protein": 5.0, "carbs": 8.0, "fat": 3.0, "fiber": 3.0}, "metadata": {"source": "Institutional", "source_reference": "Regional Study", "source_reliability": "community"}},
  {"id": "singju", "names": {"en": "Singju", "mni": "সিংজু"}, "aliases": ["Spicy salad"], "states": ["manipur"], "category": "snack", "serving_g": 100, "nutrition": {"calories": 90, "protein": 2.0, "carbs": 15.0, "fat": 2.0, "fiber": 4.0}, "metadata": {"source": "Institutional", "source_reference": "Regional Study", "source_reliability": "community"}},
  {"id": "chak-hao-kheer", "names": {"en": "Chak Hao Kheer", "mni": "চাক-হাও ক্ষীর"}, "aliases": ["Black rice pudding"], "states": ["manipur"], "category": "dessert", "serving_g": 150, "nutrition": {"calories": 250, "protein": 4.0, "carbs": 45.0, "fat": 6.0, "fiber": 2.0}, "metadata": {"source": "Institutional", "source_reference": "Regional Study", "source_reliability": "community"}},
  {"id": "ngari-chutney", "names": {"en": "Ngari Chutney", "mni": "ঙারি চাটনি"}, "aliases": ["Fermented fish chutney"], "states": ["manipur"], "category": "side", "serving_g": 50, "nutrition": {"calories": 70, "protein": 8.0, "carbs": 2.0, "fat": 3.0, "fiber": 0.5}, "metadata": {"source": "Institutional", "source_reference": "Regional Study", "source_reliability": "community"}},
  {"id": "kabok", "names": {"en": "Kabok", "mni": "কবোত"}, "aliases": ["Puffed rice snack"], "states": ["manipur"], "category": "snack", "serving_g": 50, "nutrition": {"calories": 180, "protein": 2.0, "carbs": 35.0, "fat": 3.0, "fiber": 1.0}, "metadata": {"source": "Institutional", "source_reference": "Regional Study", "source_reliability": "community"}},
  {"id": "kangshoi", "names": {"en": "Kangshoi", "mni": "কাংশোই"}, "aliases": ["Veg stew"], "states": ["manipur"], "category": "main", "serving_g": 200, "nutrition": {"calories": 60, "protein": 2.0, "carbs": 10.0, "fat": 1.0, "fiber": 3.0}, "metadata": {"source": "Institutional", "source_reference": "Regional Study", "source_reliability": "community"}},
  {"id": "morok-metpa", "names": {"en": "Morok Metpa", "mni": "মোরোক মেটপা"}, "aliases": ["Spicy chili chutney"], "states": ["manipur"], "category": "side", "serving_g": 50, "nutrition": {"calories": 30, "protein": 1.0, "carbs": 5.0, "fat": 0.5, "fiber": 1.0}, "metadata": {"source": "Institutional", "source_reference": "Regional Study", "source_reliability": "community"}},
  {"id": "paaknam", "names": {"en": "Paaknam", "mni": "পাকনাম"}, "aliases": ["Steamed cake"], "states": ["manipur"], "category": "snack", "serving_g": 100, "nutrition": {"calories": 140, "protein": 4.0, "carbs": 20.0, "fat": 5.0, "fiber": 2.0}, "metadata": {"source": "Institutional", "source_reference": "Regional Study", "source_reliability": "community"}},
  {"id": "thoiding-metpa", "names": {"en": "Thoiding Metpa", "mni": "থৈদিং মেটপা"}, "aliases": ["Perilla seed chutney"], "states": ["manipur"], "category": "side", "serving_g": 50, "nutrition": {"calories": 100, "protein": 3.0, "carbs": 5.0, "fat": 8.0, "fiber": 2.0}, "metadata": {"source": "Institutional", "source_reference": "Regional Study", "source_reliability": "community"}},
  {"id": "soibum", "names": {"en": "Soibum", "mni": "সৈবুম"}, "aliases": ["Fermented bamboo"], "states": ["manipur"], "category": "side", "serving_g": 100, "nutrition": {"calories": 40, "protein": 2.0, "carbs": 6.0, "fat": 0.5, "fiber": 3.0}, "metadata": {"source": "Institutional", "source_reference": "Regional Study", "source_reliability": "community"}},
  {"id": "eromba-mash", "names": {"en": "Eromba Mash", "mni": "ইরোম্বা"}, "aliases": ["Mash"], "states": ["manipur"], "category": "side", "serving_g": 50, "nutrition": {"calories": 40, "protein": 2.5, "carbs": 4.0, "fat": 1.5, "fiber": 1.5}, "metadata": {"source": "Institutional", "source_reference": "Regional Study", "source_reliability": "community"}},
  {"id": "singju-salad", "names": {"en": "Singju Salad", "mni": "সিংজু"}, "aliases": ["Salad"], "states": ["manipur"], "category": "snack", "serving_g": 50, "nutrition": {"calories": 45, "protein": 1.0, "carbs": 7.5, "fat": 1.0, "fiber": 2.0}, "metadata": {"source": "Institutional", "source_reference": "Regional Study", "source_reliability": "community"}},
  {"id": "chak-hao-dessert", "names": {"en": "Chak Hao Dessert", "mni": "চাক-হাও"}, "aliases": ["Dessert"], "states": ["manipur"], "category": "dessert", "serving_g": 75, "nutrition": {"calories": 125, "protein": 2.0, "carbs": 22.5, "fat": 3.0, "fiber": 1.0}, "metadata": {"source": "Institutional", "source_reference": "Regional Study", "source_reliability": "community"}},
  {"id": "ngari-side", "names": {"en": "Ngari Side", "mni": "ঙারি"}, "aliases": ["Chutney"], "states": ["manipur"], "category": "side", "serving_g": 25, "nutrition": {"calories": 35, "protein": 4.0, "carbs": 1.0, "fat": 1.5, "fiber": 0.25}, "metadata": {"source": "Institutional", "source_reference": "Regional Study", "source_reliability": "community"}},
  {"id": "kabok-snack", "names": {"en": "Kabok Snack", "mni": "কবোত"}, "aliases": ["Snack"], "states": ["manipur"], "category": "snack", "serving_g": 25, "nutrition": {"calories": 90, "protein": 1.0, "carbs": 17.5, "fat": 1.5, "fiber": 0.5}, "metadata": {"source": "Institutional", "source_reference": "Regional Study", "source_reliability": "community"}},
  {"id": "kangshoi-stew", "names": {"en": "Kangshoi Stew", "mni": "কাংশোই"}, "aliases": ["Stew"], "states": ["manipur"], "category": "main", "serving_g": 100, "nutrition": {"calories": 30, "protein": 1.0, "carbs": 5.0, "fat": 0.5, "fiber": 1.5}, "metadata": {"source": "Institutional", "source_reference": "Regional Study", "source_reliability": "community"}},
  {"id": "morok-metpa-chutney", "names": {"en": "Morok Metpa Chutney", "mni": "মোরোক মেটপা"}, "aliases": ["Chutney"], "states": ["manipur"], "category": "side", "serving_g": 25, "nutrition": {"calories": 15, "protein": 0.5, "carbs": 2.5, "fat": 0.25, "fiber": 0.5}, "metadata": {"source": "Institutional", "source_reference": "Regional Study", "source_reliability": "community"}},
  {"id": "paaknam-cake", "names": {"en": "Paaknam Cake", "mni": "পাকনাম"}, "aliases": ["Snack"], "states": ["manipur"], "category": "snack", "serving_g": 50, "nutrition": {"calories": 70, "protein": 2.0, "carbs": 10.0, "fat": 2.5, "fiber": 1.0}, "metadata": {"source": "Institutional", "source_reference": "Regional Study", "source_reliability": "community"}},
  {"id": "thoiding-chutney", "names": {"en": "Thoiding Chutney", "mni": "থৈদিং মেটপা"}, "aliases": ["Chutney"], "states": ["manipur"], "category": "side", "serving_g": 25, "nutrition": {"calories": 50, "protein": 1.5, "carbs": 2.5, "fat": 4.0, "fiber": 1.0}, "metadata": {"source": "Institutional", "source_reference": "Regional Study", "source_reliability": "community"}},
  {"id": "soibum-side", "names": {"en": "Soibum Side", "mni": "সৈবুম"}, "aliases": ["Side"], "states": ["manipur"], "category": "side", "serving_g": 50, "nutrition": {"calories": 20, "protein": 1.0, "carbs": 3.0, "fat": 0.25, "fiber": 1.5}, "metadata": {"source": "Institutional", "source_reference": "Regional Study", "source_reliability": "community"}}
]
