[
  {"id": "potato", "names": {"en": "Potato"}, "aliases": ["Aloo"], "category": "vegetables", "serving_g": 100, "nutrition": {"calories": 77, "protein": 2.0, "carbs": 17.0, "fat": 0.1, "fiber": 2.2}, "metadata": {"source": "IFCT-2017", "source_reference": "Table 7.2", "source_reliability": "institutional"}},
  {"id": "onion", "names": {"en": "Onion"}, "aliases": ["Pyaz", "Vengayam"], "category": "vegetables", "serving_g": 100, "nutrition": {"calories": 40, "protein": 1.1, "carbs": 9.3, "fat": 0.1, "fiber": 1.7}, "metadata": {"source": "IFCT-2017", "source_reference": "Table 7.2", "source_reliability": "institutional"}},
  {"id": "tomato", "names": {"en": "Tomato"}, "aliases": ["Tamatar", "Thakkali"], "category": "vegetables", "serving_g": 100, "nutrition": {"calories": 18, "protein": 0.9, "carbs": 3.9, "fat": 0.2, "fiber": 1.2}, "metadata": {"source": "IFCT-2017", "source_reference": "Table 7.2", "source_reliability": "institutional"}},
  {"id": "carrot", "names": {"en": "Carrot"}, "aliases": ["Gajar"], "category": "vegetables", "serving_g": 100, "nutrition": {"calories": 41, "protein": 0.9, "carbs": 9.6, "fat": 0.2, "fiber": 2.8}, "metadata": {"source": "IFCT-2017", "source_reference": "Table 7.2", "source_reliability": "institutional"}},
  {"id": "beetroot", "names": {"en": "Beetroot"}, "aliases": ["Chukandar"], "category": "vegetables", "serving_g": 100, "nutrition": {"calories": 43, "protein": 1.6, "carbs": 9.6, "fat": 0.2, "fiber": 2.8}, "metadata": {"source": "IFCT-2017", "source_reference": "Table 7.2", "source_reliability": "institutional"}},
  {"id": "cabbage", "names": {"en": "Cabbage"}, "aliases": ["Patta Gobhi"], "category": "vegetables", "serving_g": 100, "nutrition": {"calories": 25, "protein": 1.3, "carbs": 5.8, "fat": 0.1, "fiber": 2.5}, "metadata": {"source": "IFCT-2017", "source_reference": "Table 7.2", "source_reliability": "institutional"}},
  {"id": "cauliflower", "names": {"en": "Cauliflower"}, "aliases": ["Phool Gobhi"], "category": "vegetables", "serving_g": 100, "nutrition": {"calories": 25, "protein": 1.9, "carbs": 5.0, "fat": 0.3, "fiber": 2.0}, "metadata": {"source": "IFCT-2017", "source_reference": "Table 7.2", "source_reliability": "institutional"}},
  {"id": "broccoli", "names": {"en": "Broccoli"}, "aliases": ["Broccoli"], "category": "vegetables", "serving_g": 100, "nutrition": {"calories": 34, "protein": 2.8, "carbs": 6.6, "fat": 0.4, "fiber": 2.6}, "metadata": {"source": "IFCT-2017", "source_reference": "Table 7.2", "source_reliability": "institutional"}},
  {"id": "spinach", "names": {"en": "Spinach"}, "aliases": ["Palak", "Keerai"], "category": "vegetables", "serving_g": 100, "nutrition": {"calories": 23, "protein": 2.9, "carbs": 3.6, "fat": 0.4, "fiber": 2.2}, "metadata": {"source": "IFCT-2017", "source_reference": "Table 7.2", "source_reliability": "institutional"}},
  {"id": "okra", "names": {"en": "Okra"}, "aliases": ["Bhindi", "Vendakkai"], "category": "vegetables", "serving_g": 100, "nutrition": {"calories": 33, "protein": 1.9, "carbs": 7.0, "fat": 0.2, "fiber": 3.2}, "metadata": {"source": "IFCT-2017", "source_reference": "Table 7.2", "source_reliability": "institutional"}},
  {"id": "brinjal", "names": {"en": "Brinjal"}, "aliases": ["Baingan", "Kathirikai"], "category": "vegetables", "serving_g": 100, "nutrition": {"calories": 25, "protein": 1.0, "carbs": 5.7, "fat": 0.2, "fiber": 3.0}, "metadata": {"source": "IFCT-2017", "source_reference": "Table 7.2", "source_reliability": "institutional"}},
  {"id": "pumpkin", "names": {"en": "Pumpkin"}, "aliases": ["Kaddu"], "category": "vegetables", "serving_g": 100, "nutrition": {"calories": 26, "protein": 1.0, "carbs": 6.5, "fat": 0.1, "fiber": 0.5}, "metadata": {"source": "IFCT-2017", "source_reference": "Table 7.2", "source_reliability": "institutional"}},
  {"id": "bitter-gourd", "names": {"en": "Bitter Gourd"}, "aliases": ["Karela", "Pavakkai"], "category": "vegetables", "serving_g": 100, "nutrition": {"calories": 17, "protein": 1.0, "carbs": 3.7, "fat": 0.2, "fiber": 2.8}, "metadata": {"source": "IFCT-2017", "source_reference": "Table 7.2", "source_reliability": "institutional"}},
  {"id": "bottle-gourd", "names": {"en": "Bottle Gourd"}, "aliases": ["Lauki", "Sorakkai"], "category": "vegetables", "serving_g": 100, "nutrition": {"calories": 15, "protein": 0.6, "carbs": 3.6, "fat": 0.1, "fiber": 0.5}, "metadata": {"source": "IFCT-2017", "source_reference": "Table 7.2", "source_reliability": "institutional"}},
  {"id": "cucumber", "names": {"en": "Cucumber"}, "aliases": ["Kheera", "Vellarikai"], "category": "vegetables", "serving_g": 100, "nutrition": {"calories": 15, "protein": 0.7, "carbs": 3.6, "fat": 0.1, "fiber": 0.5}, "metadata": {"source": "IFCT-2017", "source_reference": "Table 7.2", "source_reliability": "institutional"}},
  {"id": "beans", "names": {"en": "French Beans"}, "aliases": ["Beans", "Pharasbi"], "category": "vegetables", "serving_g": 100, "nutrition": {"calories": 31, "protein": 1.8, "carbs": 7.0, "fat": 0.2, "fiber": 2.7}, "metadata": {"source": "IFCT-2017", "source_reference": "Table 7.2", "source_reliability": "institutional"}},
  {"id": "capsicum", "names": {"en": "Capsicum"}, "aliases": ["Shimla Mirch"], "category": "vegetables", "serving_g": 100, "nutrition": {"calories": 20, "protein": 0.9, "carbs": 4.6, "fat": 0.2, "fiber": 1.7}, "metadata": {"source": "IFCT-2017", "source_reference": "Table 7.2", "source_reliability": "institutional"}},
  {"id": "radish", "names": {"en": "Radish"}, "aliases": ["Mooli"], "category": "vegetables", "serving_g": 100, "nutrition": {"calories": 16, "protein": 0.7, "carbs": 3.4, "fat": 0.1, "fiber": 1.6}, "metadata": {"source": "IFCT-2017", "source_reference": "Table 7.2", "source_reliability": "institutional"}},
  {"id": "ginger", "names": {"en": "Ginger"}, "aliases": ["Adrak"], "category": "vegetables", "serving_g": 100, "nutrition": {"calories": 80, "protein": 1.8, "carbs": 17.8, "fat": 0.8, "fiber": 2.0}, "metadata": {"source": "IFCT-2017", "source_reference": "Table 7.2", "source_reliability": "institutional"}},
  {"id": "garlic", "names": {"en": "Garlic"}, "aliases": ["Lehsun"], "category": "vegetables", "serving_g": 100, "nutrition": {"calories": 149, "protein": 6.4, "carbs": 33.1, "fat": 0.5, "fiber": 2.1}, "metadata": {"source": "IFCT-2017", "source_reference": "Table 7.2", "source_reliability": "institutional"}}
]
