[
  {"id": "misal-pav", "names": {"en": "Misal Pav", "mr": "मिसळ पाव"}, "aliases": ["Spicy Sprouts Curry"], "states": ["maharashtra"], "category": "breakfast", "serving_g": 100, "nutrition": {"calories": 280, "protein": 8.0, "carbs": 35.0, "fat": 12.0, "fiber": 5.0}, "metadata": {"source": "IFCT-2017", "source_reference": "Table 7.2", "source_reliability": "institutional"}},
  {"id": "vada-pav", "names": {"en": "Vada Pav", "mr": "वडा पाव"}, "aliases": ["Indian Burger"], "states": ["maharashtra"], "category": "street-food", "serving_g": 100, "nutrition": {"calories": 300, "protein": 5.0, "carbs": 40.0, "fat": 14.0, "fiber": 2.0}, "metadata": {"source": "IFCT-2017", "source_reference": "Table 7.2", "source_reliability": "institutional"}},
  {"id": "puran-poli", "names": {"en": "Puran Poli", "mr": "पुरण पोळी"}, "aliases": ["Sweet Flatbread"], "states": ["maharashtra"], "category": "dessert", "serving_g": 100, "nutrition": {"calories": 320, "protein": 7.5, "carbs": 50.0, "fat": 9.5, "fiber": 3.5}, "metadata": {"source": "IFCT-2017", "source_reference": "Table 7.2", "source_reliability": "institutional"}},
  {"id": "kanda-pohe", "names": {"en": "Kanda Pohe", "mr": "कांदा पोहे"}, "aliases": ["Flattened Rice"], "states": ["maharashtra", "madhya-pradesh"], "category": "breakfast", "serving_g": 100, "nutrition": {"calories": 180, "protein": 3.5, "carbs": 35.0, "fat": 4.0, "fiber": 2.0}, "metadata": {"source": "IFCT-2017", "source_reference": "Table 7.2", "source_reliability": "institutional"}},
  {"id": "sabudana-khichdi", "names": {"en": "Sabudana Khichdi", "mr": "साबुदाणा खिचडी"}, "aliases": ["Sago Dish"], "states": ["maharashtra"], "category": "breakfast", "serving_g": 100, "nutrition": {"calories": 240, "protein": 1.0, "carbs": 50.0, "fat": 4.0, "fiber": 1.0}, "metadata": {"source": "IFCT-2017", "source_reference": "Table 7.2", "source_reliability": "institutional"}}
]
