[
  {"id": "oats-instant", "names": {"en": "Instant Oats"}, "aliases": ["Quick Oats"], "category": "grains-and-cereals", "serving_g": 100, "nutrition": {"calories": 379, "protein": 13.0, "carbs": 66.0, "fat": 7.0, "fiber": 10.0}, "metadata": {"source": "IFCT-2017", "source_reference": "Table 7.2", "source_reliability": "institutional"}},
  {"id": "quinoa-cooked", "names": {"en": "Quinoa Cooked"}, "aliases": ["Cooked Quinoa"], "category": "grains-and-cereals", "serving_g": 100, "nutrition": {"calories": 120, "protein": 4.4, "carbs": 21.0, "fat": 1.9, "fiber": 2.8}, "metadata": {"source": "USDA", "source_reference": "Database", "source_reliability": "community"}},
  {"id": "barley", "names": {"en": "Barley"}, "aliases": ["Jau"], "category": "grains-and-cereals", "serving_g": 100, "nutrition": {"calories": 354, "protein": 12.5, "carbs": 73.5, "fat": 2.3, "fiber": 17.3}, "metadata": {"source": "IFCT-2017", "source_reference": "Table 7.2", "source_reliability": "institutional"}},
  {"id": "millet-finger", "names": {"en": "Finger Millet"}, "aliases": ["Ragi"], "category": "grains-and-cereals", "serving_g": 100, "nutrition": {"calories": 328, "protein": 7.3, "carbs": 72.0, "fat": 1.3, "fiber": 3.6}, "metadata": {"source": "IFCT-2017", "source_reference": "Table 7.2", "source_reliability": "institutional"}},
  {"id": "wheat-flour", "names": {"en": "Wheat Flour"}, "aliases": ["Atta"], "category": "grains-and-cereals", "serving_g": 100, "nutrition": {"calories": 341, "protein": 12.0, "carbs": 71.0, "fat": 1.7, "fiber": 12.2}, "metadata": {"source": "IFCT-2017", "source_reference": "Table 7.2", "source_reliability": "institutional"}}
]
