[
  {"id": "dhokla", "names": {"en": "Dhokla", "gu": "ઢોકળા"}, "aliases": ["Spiced Steamed Cake"], "states": ["gujarat"], "category": "breakfast", "serving_g": 100, "nutrition": {"calories": 160, "protein": 5.0, "carbs": 25.0, "fat": 4.0, "fiber": 2.0}, "metadata": {"source": "IFCT-2017", "source_reference": "Table 7.2", "source_reliability": "institutional"}},
  {"id": "fafda", "names": {"en": "Fafda", "gu": "ફાફડા"}, "aliases": ["Gram Flour Snack"], "states": ["gujarat"], "category": "snack", "serving_g": 100, "nutrition": {"calories": 520, "protein": 9.0, "carbs": 45.0, "fat": 30.0, "fiber": 2.0}, "metadata": {"source": "IFCT-2017", "source_reference": "Table 7.2", "source_reliability": "institutional"}},
  {"id": "khandvi", "names": {"en": "Khandvi", "gu": "ખાંડવી"}, "aliases": ["Gram Flour Rolls"], "states": ["gujarat"], "category": "snack", "serving_g": 100, "nutrition": {"calories": 140, "protein": 3.0, "carbs": 18.0, "fat": 5.0, "fiber": 1.0}, "metadata": {"source": "IFCT-2017", "source_reference": "Table 7.2", "source_reliability": "institutional"}},
  {"id": "undhiyu", "names": {"en": "Undhiyu", "gu": "ઉંધિયું"}, "aliases": ["Mixed Vegetable Curry"], "states": ["gujarat"], "category": "main", "serving_g": 100, "nutrition": {"calories": 180, "protein": 3.0, "carbs": 20.0, "fat": 8.0, "fiber": 4.0}, "metadata": {"source": "IFCT-2017", "source_reference": "Table 7.2", "source_reliability": "institutional"}},
  {"id": "thepla", "names": {"en": "Thepla", "gu": "થેપલા"}, "aliases": ["Spiced Flatbread"], "states": ["gujarat"], "category": "breakfast", "serving_g": 100, "nutrition": {"calories": 250, "protein": 5.0, "carbs": 38.0, "fat": 7.0, "fiber": 3.0}, "metadata": {"source": "IFCT-2017", "source_reference": "Table 7.2", "source_reliability": "institutional"}}
]
