[
  {"id": "chole-bhature-chd", "names": {"en": "Chole Bhature", "pa": "ਛੋਲੇ ਭਟੂਰੇ"}, "aliases": ["Chickpea curry"], "states": ["chandigarh"], "category": "breakfast", "serving_g": 300, "nutrition": {"calories": 500, "protein": 12.0, "carbs": 60.0, "fat": 20.0, "fiber": 8.0}, "metadata": {"source": "Institutional", "source_reference": "Regional Study", "source_reliability": "community"}},
  {"id": "amritsari-kulcha-chd", "names": {"en": "Amritsari Kulcha", "pa": "ਅੰਮ੍ਰਿਤਸਰੀ ਕੁਲਚਾ"}, "aliases": ["Stuffed bread"], "states": ["chandigarh"], "category": "breakfast", "serving_g": 150, "nutrition": {"calories": 320, "protein": 7.0, "carbs": 45.0, "fat": 10.0, "fiber": 3.0}, "metadata": {"source": "Institutional", "source_reference": "Regional Study", "source_reliability": "community"}},
  {"id": "dal-makhani-chd", "names": {"en": "Dal Makhani", "pa": "ਦਾਲ ਮੱਖਣੀ"}, "aliases": ["Creamy lentil"], "states": ["chandigarh"], "category": "main", "serving_g": 200, "nutrition": {"calories": 280, "protein": 10.0, "carbs": 30.0, "fat": 12.0, "fiber": 8.0}, "metadata": {"source": "Institutional", "source_reference": "Regional Study", "source_reliability": "community"}},
  {"id": "butter-chicken-chd", "names": {"en": "Butter Chicken", "pa": "ਬਟਰ ਚਿਕਨ"}, "aliases": ["Chicken curry"], "states": ["chandigarh"], "category": "main", "serving_g": 200, "nutrition": {"calories": 350, "protein": 25.0, "carbs": 10.0, "fat": 25.0, "fiber": 1.0}, "metadata": {"source": "Institutional", "source_reference": "Regional Study", "source_reliability": "community"}},
  {"id": "paneer-tikka-chd", "names": {"en": "Paneer Tikka", "pa": "ਪਨੀਰ ਟਿੱਕਾ"}, "aliases": ["Grilled paneer"], "states": ["chandigarh"], "category": "snack", "serving_g": 100, "nutrition": {"calories": 220, "protein": 15.0, "carbs": 5.0, "fat": 15.0, "fiber": 1.0}, "metadata": {"source": "Institutional", "source_reference": "Regional Study", "source_reliability": "community"}},
  {"id": "lassi-chd", "names": {"en": "Lassi", "pa": "ਲੱਸੀ"}, "aliases": ["Yogurt drink"], "states": ["chandigarh"], "category": "breakfast", "serving_g": 300, "nutrition": {"calories": 200, "protein": 6.0, "carbs": 25.0, "fat": 8.0, "fiber": 0.0}, "metadata": {"source": "Institutional", "source_reference": "Regional Study", "source_reliability": "community"}},
  {"id": "rajma-chawal-chd", "names": {"en": "Rajma Chawal", "pa": "ਰਾਜਮਾ ਚੌਲ"}, "aliases": ["Kidney beans and rice"], "states": ["chandigarh"], "category": "main", "serving_g": 300, "nutrition": {"calories": 400, "protein": 15.0, "carbs": 60.0, "fat": 8.0, "fiber": 10.0}, "metadata": {"source": "Institutional", "source_reference": "Regional Study", "source_reliability": "community"}},
  {"id": "paratha-chd", "names": {"en": "Paratha", "pa": "ਪਰਾਠਾ"}, "aliases": ["Stuffed bread"], "states": ["chandigarh"], "category": "breakfast", "serving_g": 100, "nutrition": {"calories": 280, "protein": 6.0, "carbs": 35.0, "fat": 12.0, "fiber": 2.5}, "metadata": {"source": "Institutional", "source_reference": "Regional Study", "source_reliability": "community"}},
  {"id": "gajar-halwa-chd", "names": {"en": "Gajar Halwa", "pa": "ਗਾਜਰ ਹਲਵਾ"}, "aliases": ["Carrot dessert"], "states": ["chandigarh"], "category": "dessert", "serving_g": 100, "nutrition": {"calories": 250, "protein": 3.0, "carbs": 35.0, "fat": 10.0, "fiber": 2.0}, "metadata": {"source": "Institutional", "source_reference": "Regional Study", "source_reliability": "community"}},
  {"id": "chole-bhature-main-chd", "names": {"en": "Chole Bhature Main", "pa": "ਛੋਲੇ"}, "aliases": ["Main"], "states": ["chandigarh"], "category": "breakfast", "serving_g": 150, "nutrition": {"calories": 250, "protein": 6.0, "carbs": 30.0, "fat": 10.0, "fiber": 4.0}, "metadata": {"source": "Institutional", "source_reference": "Regional Study", "source_reliability": "community"}},
  {"id": "amritsari-kulcha-side-chd", "names": {"en": "Amritsari Kulcha Side", "pa": "ਕੁਲਚਾ"}, "aliases": ["Side"], "states": ["chandigarh"], "category": "breakfast", "serving_g": 75, "nutrition": {"calories": 160, "protein": 3.5, "carbs": 22.5, "fat": 5.0, "fiber": 1.5}, "metadata": {"source": "Institutional", "source_reference": "Regional Study", "source_reliability": "community"}},
  {"id": "dal-makhani-main-chd", "names": {"en": "Dal Makhani Main", "pa": "ਦਾਲ"}, "aliases": ["Main"], "states": ["chandigarh"], "category": "main", "serving_g": 100, "nutrition": {"calories": 140, "protein": 5.0, "carbs": 15.0, "fat": 6.0, "fiber": 4.0}, "metadata": {"source": "Institutional", "source_reference": "Regional Study", "source_reliability": "community"}},
  {"id": "butter-chicken-main-chd", "names": {"en": "Butter Chicken Main", "pa": "ਚਿਕਨ"}, "aliases": ["Main"], "states": ["chandigarh"], "category": "main", "serving_g": 100, "nutrition": {"calories": 175, "protein": 12.5, "carbs": 5.0, "fat": 12.5, "fiber": 0.5}, "metadata": {"source": "Institutional", "source_reference": "Regional Study", "source_reliability": "community"}},
  {"id": "paneer-tikka-snack-chd", "names": {"en": "Paneer Tikka Snack", "pa": "ਪਨੀਰ"}, "aliases": ["Snack"], "states": ["chandigarh"], "category": "snack", "serving_g": 50, "nutrition": {"calories": 110, "protein": 7.5, "carbs": 2.5, "fat": 7.5, "fiber": 0.5}, "metadata": {"source": "Institutional", "source_reference": "Regional Study", "source_reliability": "community"}},
  {"id": "lassi-drink-chd", "names": {"en": "Lassi Drink", "pa": "ਲੱਸੀ"}, "aliases": ["Drink"], "states": ["chandigarh"], "category": "breakfast", "serving_g": 150, "nutrition": {"calories": 100, "protein": 3.0, "carbs": 12.5, "fat": 4.0, "fiber": 0.0}, "metadata": {"source": "Institutional", "source_reference": "Regional Study", "source_reliability": "community"}},
  {"id": "rajma-chawal-main-chd", "names": {"en": "Rajma Chawal Main", "pa": "ਰਾਜਮਾ"}, "aliases": ["Main"], "states": ["chandigarh"], "category": "main", "serving_g": 150, "nutrition": {"calories": 200, "protein": 7.5, "carbs": 30.0, "fat": 4.0, "fiber": 5.0}, "metadata": {"source": "Institutional", "source_reference": "Regional Study", "source_reliability": "community"}},
  {"id": "paratha-breakfast-chd", "names": {"en": "Paratha Breakfast", "pa": "ਪਰਾਠਾ"}, "aliases": ["Breakfast"], "states": ["chandigarh"], "category": "breakfast", "serving_g": 50, "nutrition": {"calories": 140, "protein": 3.0, "carbs": 17.5, "fat": 6.0, "fiber": 1.25}, "metadata": {"source": "Institutional", "source_reference": "Regional Study", "source_reliability": "community"}},
  {"id": "gajar-halwa-dessert-chd", "names": {"en": "Gajar Halwa Dessert", "pa": "ਗਾਜਰ ਹਲਵਾ"}, "aliases": ["Dessert"], "states": ["chandigarh"], "category": "dessert", "serving_g": 50, "nutrition": {"calories": 125, "protein": 1.5, "carbs": 17.5, "fat": 5.0, "fiber": 1.0}, "metadata": {"source": "Institutional", "source_reference": "Regional Study", "source_reliability": "community"}},
  {"id": "chole-bhature-main2-chd", "names": {"en": "Chole Bhature Main2", "pa": "ਛੋਲੇ"}, "aliases": ["Main"], "states": ["chandigarh"], "category": "breakfast", "serving_g": 75, "nutrition": {"calories": 125, "protein": 3.0, "carbs": 15.0, "fat": 5.0, "fiber": 2.0}, "metadata": {"source": "Institutional", "source_reference": "Regional Study", "source_reliability": "community"}},
  {"id": "amritsari-kulcha-side2-chd", "names": {"en": "Amritsari Kulcha Side2", "pa": "ਕੁਲਚਾ"}, "aliases": ["Side"], "states": ["chandigarh"], "category": "breakfast", "serving_g": 37.5, "nutrition": {"calories": 80, "protein": 1.75, "carbs": 11.25, "fat": 2.5, "fiber": 0.75}, "metadata": {"source": "Institutional", "source_reference": "Regional Study", "source_reliability": "community"}}
]
