[
  {"id": "siddu", "names": {"en": "Siddu", "hi": "सिड्डू"}, "aliases": ["Steamed stuffed wheat bun"], "states": ["himachal-pradesh"], "category": "breakfast", "serving_g": 150, "nutrition": {"calories": 280, "protein": 8.0, "carbs": 50.0, "fat": 5.0, "fiber": 4.0}, "metadata": {"source": "Institutional", "source_reference": "Regional Study", "source_reliability": "community"}},
  {"id": "dham", "names": {"en": "Dham", "hi": "धाम"}, "aliases": ["Traditional feast meal"], "states": ["himachal-pradesh"], "category": "main", "serving_g": 300, "nutrition": {"calories": 400, "protein": 12.0, "carbs": 60.0, "fat": 10.0, "fiber": 5.0}, "metadata": {"source": "Institutional", "source_reference": "Regional Study", "source_reliability": "community"}},
  {"id": "babru", "names": {"en": "Babru", "hi": "बबरू"}, "aliases": ["Stuffed fried bread"], "states": ["himachal-pradesh"], "category": "breakfast", "serving_g": 100, "nutrition": {"calories": 310, "protein": 7.0, "carbs": 35.0, "fat": 15.0, "fiber": 2.5}, "metadata": {"source": "Institutional", "source_reference": "Regional Study", "source_reliability": "community"}},
  {"id": "chana-madra", "names": {"en": "Chana Madra", "hi": "चना मद्रा"}, "aliases": ["Chickpea yogurt curry"], "states": ["himachal-pradesh"], "category": "main", "serving_g": 200, "nutrition": {"calories": 180, "protein": 6.0, "carbs": 25.0, "fat": 6.0, "fiber": 4.0}, "metadata": {"source": "Institutional", "source_reference": "Regional Study", "source_reliability": "community"}},
  {"id": "tukpa", "names": {"en": "Tukpa", "hi": "तुकपा"}, "aliases": ["Noodle soup"], "states": ["himachal-pradesh"], "category": "main", "serving_g": 300, "nutrition": {"calories": 260, "protein": 9.0, "carbs": 48.0, "fat": 4.0, "fiber": 3.0}, "metadata": {"source": "Institutional", "source_reference": "Regional Study", "source_reliability": "community"}},
  {"id": "mittha", "names": {"en": "Mittha", "hi": "मिठ्ठा"}, "aliases": ["Sweetened rice"], "states": ["himachal-pradesh"], "category": "dessert", "serving_g": 150, "nutrition": {"calories": 300, "protein": 3.0, "carbs": 55.0, "fat": 6.0, "fiber": 1.0}, "metadata": {"source": "Institutional", "source_reference": "Regional Study", "source_reliability": "community"}},
  {"id": "aktori", "names": {"en": "Aktori", "hi": "अक्तोरी"}, "aliases": ["Buckwheat cake"], "states": ["himachal-pradesh"], "category": "dessert", "serving_g": 100, "nutrition": {"calories": 220, "protein": 5.0, "carbs": 40.0, "fat": 4.0, "fiber": 3.0}, "metadata": {"source": "Institutional", "source_reference": "Regional Study", "source_reliability": "community"}},
  {"id": "bhey", "names": {"en": "Bhey", "hi": "भेय"}, "aliases": ["Lotus stem curry"], "states": ["himachal-pradesh"], "category": "side", "serving_g": 100, "nutrition": {"calories": 80, "protein": 2.0, "carbs": 12.0, "fat": 2.5, "fiber": 3.0}, "metadata": {"source": "Institutional", "source_reference": "Regional Study", "source_reliability": "community"}},
  {"id": "gulgule", "names": {"en": "Gulgule", "hi": "गुल्गुले"}, "aliases": ["Sweet fried balls"], "states": ["himachal-pradesh"], "category": "snack", "serving_g": 50, "nutrition": {"calories": 200, "protein": 2.0, "carbs": 30.0, "fat": 8.0, "fiber": 1.0}, "metadata": {"source": "Institutional", "source_reference": "Regional Study", "source_reliability": "community"}},
  {"id": "khatta", "names": {"en": "Khatta", "hi": "खट्टा"}, "aliases": ["Tangy pumpkin curry"], "states": ["himachal-pradesh"], "category": "side", "serving_g": 150, "nutrition": {"calories": 90, "protein": 1.5, "carbs": 15.0, "fat": 2.5, "fiber": 2.0}, "metadata": {"source": "Institutional", "source_reference": "Regional Study", "source_reliability": "community"}},
  {"id": "siddu-stuffed", "names": {"en": "Siddu Stuffed", "hi": "सिड्डू"}, "aliases": ["Bun"], "states": ["himachal-pradesh"], "category": "breakfast", "serving_g": 75, "nutrition": {"calories": 140, "protein": 4.0, "carbs": 25.0, "fat": 2.5, "fiber": 2.0}, "metadata": {"source": "Institutional", "source_reference": "Regional Study", "source_reliability": "community"}},
  {"id": "dham-main", "names": {"en": "Dham Main", "hi": "धाम"}, "aliases": ["Feast"], "states": ["himachal-pradesh"], "category": "main", "serving_g": 150, "nutrition": {"calories": 200, "protein": 6.0, "carbs": 30.0, "fat": 5.0, "fiber": 2.5}, "metadata": {"source": "Institutional", "source_reference": "Regional Study", "source_reliability": "community"}},
  {"id": "babru-fried", "names": {"en": "Babru Fried", "hi": "बबरू"}, "aliases": ["Fried bread"], "states": ["himachal-pradesh"], "category": "breakfast", "serving_g": 50, "nutrition": {"calories": 155, "protein": 3.5, "carbs": 17.5, "fat": 7.5, "fiber": 1.2}, "metadata": {"source": "Institutional", "source_reference": "Regional Study", "source_reliability": "community"}},
  {"id": "chana-madra-curry", "names": {"en": "Chana Madra Curry", "hi": "चना मद्रा"}, "aliases": ["Curry"], "states": ["himachal-pradesh"], "category": "main", "serving_g": 100, "nutrition": {"calories": 90, "protein": 3.0, "carbs": 12.5, "fat": 3.0, "fiber": 2.0}, "metadata": {"source": "Institutional", "source_reference": "Regional Study", "source_reliability": "community"}},
  {"id": "tukpa-soup", "names": {"en": "Tukpa Soup", "hi": "तुकपा"}, "aliases": ["Soup"], "states": ["himachal-pradesh"], "category": "main", "serving_g": 150, "nutrition": {"calories": 130, "protein": 4.5, "carbs": 24.0, "fat": 2.0, "fiber": 1.5}, "metadata": {"source": "Institutional", "source_reference": "Regional Study", "source_reliability": "community"}},
  {"id": "mittha-rice", "names": {"en": "Mittha Rice", "hi": "मिठ्ठा"}, "aliases": ["Dessert"], "states": ["himachal-pradesh"], "category": "dessert", "serving_g": 75, "nutrition": {"calories": 150, "protein": 1.5, "carbs": 27.5, "fat": 3.0, "fiber": 0.5}, "metadata": {"source": "Institutional", "source_reference": "Regional Study", "source_reliability": "community"}},
  {"id": "aktori-cake", "names": {"en": "Aktori Cake", "hi": "अक्तोरी"}, "aliases": ["Cake"], "states": ["himachal-pradesh"], "category": "dessert", "serving_g": 50, "nutrition": {"calories": 110, "protein": 2.5, "carbs": 20.0, "fat": 2.0, "fiber": 1.5}, "metadata": {"source": "Institutional", "source_reference": "Regional Study", "source_reliability": "community"}},
  {"id": "bhey-stem", "names": {"en": "Bhey Stem", "hi": "भेय"}, "aliases": ["Stem"], "states": ["himachal-pradesh"], "category": "side", "serving_g": 50, "nutrition": {"calories": 40, "protein": 1.0, "carbs": 6.0, "fat": 1.2, "fiber": 1.5}, "metadata": {"source": "Institutional", "source_reference": "Regional Study", "source_reliability": "community"}},
  {"id": "gulgule-snack", "names": {"en": "Gulgule Snack", "hi": "गुल्गुले"}, "aliases": ["Snack"], "states": ["himachal-pradesh"], "category": "snack", "serving_g": 25, "nutrition": {"calories": 100, "protein": 1.0, "carbs": 15.0, "fat": 4.0, "fiber": 0.5}, "metadata": {"source": "Institutional", "source_reference": "Regional Study", "source_reliability": "community"}},
  {"id": "khatta-side", "names": {"en": "Khatta Side", "hi": "खट्टा"}, "aliases": ["Side"], "states": ["himachal-pradesh"], "category": "side", "serving_g": 75, "nutrition": {"calories": 45, "protein": 0.7, "carbs": 7.5, "fat": 1.2, "fiber": 1.0}, "metadata": {"source": "Institutional", "source_reference": "Regional Study", "source_reliability": "community"}}
]
