[
  {"id": "dalma", "names": {"en": "Dalma", "or": "ଡାଲମା"}, "aliases": ["Lentil and vegetable stew"], "states": ["odisha"], "category": "main", "serving_g": 200, "nutrition": {"calories": 150, "protein": 6.0, "carbs": 25.0, "fat": 2.0, "fiber": 5.0}, "metadata": {"source": "Institutional", "source_reference": "Regional Study", "source_reliability": "community"}},
  {"id": "pakhala-bhata", "names": {"en": "Pakhala Bhata", "or": "ପଖାଳ ଭାତ"}, "aliases": ["Fermented rice"], "states": ["odisha"], "category": "main", "serving_g": 200, "nutrition": {"calories": 180, "protein": 3.0, "carbs": 40.0, "fat": 0.5, "fiber": 1.0}, "metadata": {"source": "Institutional", "source_reference": "Regional Study", "source_reliability": "community"}},
  {"id": "chhena-poda", "names": {"en": "Chhena Poda", "or": "ଛେନା ପୋଡ଼"}, "aliases": ["Baked cheese dessert"], "states": ["odisha"], "category": "dessert", "serving_g": 100, "nutrition": {"calories": 350, "protein": 8.0, "carbs": 35.0, "fat": 20.0, "fiber": 0.5}, "metadata": {"source": "Institutional", "source_reference": "Regional Study", "source_reliability": "community"}},
  {"id": "santula", "names": {"en": "Santula", "or": "ସନ୍ତୁଳା"}, "aliases": ["Mixed vegetable fry"], "states": ["odisha"], "category": "side", "serving_g": 150, "nutrition": {"calories": 80, "protein": 2.0, "carbs": 15.0, "fat": 2.0, "fiber": 3.0}, "metadata": {"source": "Institutional", "source_reference": "Regional Study", "source_reliability": "community"}},
  {"id": "kanika", "names": {"en": "Kanika", "or": "କନିକା"}, "aliases": ["Sweetened rice"], "states": ["odisha"], "category": "main", "serving_g": 150, "nutrition": {"calories": 250, "protein": 3.0, "carbs": 50.0, "fat": 4.0, "fiber": 1.0}, "metadata": {"source": "Institutional", "source_reference": "Regional Study", "source_reliability": "community"}},
  {"id": "machha-besara", "names": {"en": "Machha Besara", "or": "ମାଛ ବେସର"}, "aliases": ["Mustard fish curry"], "states": ["odisha"], "category": "main", "serving_g": 200, "nutrition": {"calories": 220, "protein": 18.0, "carbs": 5.0, "fat": 14.0, "fiber": 1.0}, "metadata": {"source": "Institutional", "source_reference": "Regional Study", "source_reliability": "community"}},
  {"id": "rasagola", "names": {"en": "Rasagola", "or": "ରସଗୋଲା"}, "aliases": ["Cottage cheese dessert"], "states": ["odisha"], "category": "dessert", "serving_g": 50, "nutrition": {"calories": 150, "protein": 2.0, "carbs": 30.0, "fat": 2.0, "fiber": 0.2}, "metadata": {"source": "Institutional", "source_reference": "Regional Study", "source_reliability": "community"}},
  {"id": "bara", "names": {"en": "Bara", "or": "ବଡ଼ା"}, "aliases": ["Lentil fritter"], "states": ["odisha"], "category": "snack", "serving_g": 50, "nutrition": {"calories": 180, "protein": 5.0, "carbs": 20.0, "fat": 9.0, "fiber": 1.5}, "metadata": {"source": "Institutional", "source_reference": "Regional Study", "source_reliability": "community"}},
  {"id": "dalma-stew", "names": {"en": "Dalma Stew", "or": "ଡାଲମା"}, "aliases": ["Stew"], "states": ["odisha"], "category": "main", "serving_g": 100, "nutrition": {"calories": 75, "protein": 3.0, "carbs": 12.5, "fat": 1.0, "fiber": 2.5}, "metadata": {"source": "Institutional", "source_reference": "Regional Study", "source_reliability": "community"}},
  {"id": "pakhala-bhata-main", "names": {"en": "Pakhala Bhata Main", "or": "ପଖାଳ"}, "aliases": ["Main"], "states": ["odisha"], "category": "main", "serving_g": 100, "nutrition": {"calories": 90, "protein": 1.5, "carbs": 20.0, "fat": 0.25, "fiber": 0.5}, "metadata": {"source": "Institutional", "source_reference": "Regional Study", "source_reliability": "community"}},
  {"id": "chhena-poda-dessert", "names": {"en": "Chhena Poda Dessert", "or": "ଛେନା ପୋଡ଼"}, "aliases": ["Dessert"], "states": ["odisha"], "category": "dessert", "serving_g": 50, "nutrition": {"calories": 175, "protein": 4.0, "carbs": 17.5, "fat": 10.0, "fiber": 0.25}, "metadata": {"source": "Institutional", "source_reference": "Regional Study", "source_reliability": "community"}},
  {"id": "santula-side", "names": {"en": "Santula Side", "or": "ସନ୍ତୁଳା"}, "aliases": ["Side"], "states": ["odisha"], "category": "side", "serving_g": 75, "nutrition": {"calories": 40, "protein": 1.0, "carbs": 7.5, "fat": 1.0, "fiber": 1.5}, "metadata": {"source": "Institutional", "source_reference": "Regional Study", "source_reliability": "community"}},
  {"id": "kanika-rice", "names": {"en": "Kanika Rice", "or": "କନିକା"}, "aliases": ["Main"], "states": ["odisha"], "category": "main", "serving_g": 75, "nutrition": {"calories": 125, "protein": 1.5, "carbs": 25.0, "fat": 2.0, "fiber": 0.5}, "metadata": {"source": "Institutional", "source_reference": "Regional Study", "source_reliability": "community"}},
  {"id": "machha-besara-main", "names": {"en": "Machha Besara Main", "or": "ମାଛ ବେସର"}, "aliases": ["Fish"], "states": ["odisha"], "category": "main", "serving_g": 100, "nutrition": {"calories": 110, "protein": 9.0, "carbs": 2.5, "fat": 7.0, "fiber": 0.5}, "metadata": {"source": "Institutional", "source_reference": "Regional Study", "source_reliability": "community"}},
  {"id": "rasagola-dessert", "names": {"en": "Rasagola Dessert", "or": "ରସଗୋଲା"}, "aliases": ["Dessert"], "states": ["odisha"], "category": "dessert", "serving_g": 25, "nutrition": {"calories": 75, "protein": 1.0, "carbs": 15.0, "fat": 1.0, "fiber": 0.1}, "metadata": {"source": "Institutional", "source_reference": "Regional Study", "source_reliability": "community"}},
  {"id": "bara-snack", "names": {"en": "Bara Snack", "or": "ବଡ଼ା"}, "aliases": ["Snack"], "states": ["odisha"], "category": "snack", "serving_g": 25, "nutrition": {"calories": 90, "protein": 2.5, "carbs": 10.0, "fat": 4.5, "fiber": 0.75}, "metadata": {"source": "Institutional", "source_reference": "Regional Study", "source_reliability": "community"}},
  {"id": "dalma-stew2", "names": {"en": "Dalma Stew2", "or": "ଡାଲମା"}, "aliases": ["Stew"], "states": ["odisha"], "category": "main", "serving_g": 100, "nutrition": {"calories": 75, "protein": 3.0, "carbs": 12.5, "fat": 1.0, "fiber": 2.5}, "metadata": {"source": "Institutional", "source_reference": "Regional Study", "source_reliability": "community"}},
  {"id": "pakhala-bhata-main2", "names": {"en": "Pakhala Bhata Main2", "or": "ପଖାଳ"}, "aliases": ["Main"], "states": ["odisha"], "category": "main", "serving_g": 100, "nutrition": {"calories": 90, "protein": 1.5, "carbs": 20.0, "fat": 0.25, "fiber": 0.5}, "metadata": {"source": "Institutional", "source_reference": "Regional Study", "source_reliability": "community"}},
  {"id": "chhena-poda-dessert2", "names": {"en": "Chhena Poda Dessert2", "or": "ଛେନା ପୋଡ଼"}, "aliases": ["Dessert"], "states": ["odisha"], "category": "dessert", "serving_g": 50, "nutrition": {"calories": 175, "protein": 4.0, "carbs": 17.5, "fat": 10.0, "fiber": 0.25}, "metadata": {"source": "Institutional", "source_reference": "Regional Study", "source_reliability": "community"}},
  {"id": "santula-side2", "names": {"en": "Santula Side2", "or": "ସନ୍ତୁଳା"}, "aliases": ["Side"], "states": ["odisha"], "category": "side", "serving_g": 75, "nutrition": {"calories": 40, "protein": 1.0, "carbs": 7.5, "fat": 1.0, "fiber": 1.5}, "metadata": {"source": "Institutional", "source_reference": "Regional Study", "source_reliability": "community"}}
]
