[
  {"id": "chakhwi", "names": {"en": "Chakhwi", "kok": "Chakhwi"}, "aliases": ["Rice and lentil dish"], "states": ["tripura"], "category": "main", "serving_g": 200, "nutrition": {"calories": 180, "protein": 5.0, "carbs": 35.0, "fat": 2.0, "fiber": 4.0}, "metadata": {"source": "Institutional", "source_reference": "Regional Study", "source_reliability": "community"}},
  {"id": "muya-awandru", "names": {"en": "Muya Awandru", "kok": "Muya Awandru"}, "aliases": ["Bamboo shoot curry"], "states": ["tripura"], "category": "side", "serving_g": 150, "nutrition": {"calories": 60, "protein": 2.0, "carbs": 10.0, "fat": 1.0, "fiber": 3.0}, "metadata": {"source": "Institutional", "source_reference": "Regional Study", "source_reliability": "community"}},
  {"id": "mosdeng-serma", "names": {"en": "Mosdeng Serma", "kok": "Mosdeng Serma"}, "aliases": ["Spicy tomato chutney"], "states": ["tripura"], "category": "side", "serving_g": 50, "nutrition": {"calories": 30, "protein": 1.0, "carbs": 5.0, "fat": 0.5, "fiber": 1.5}, "metadata": {"source": "Institutional", "source_reference": "Regional Study", "source_reliability": "community"}},
  {"id": "wahan-mosdeng", "names": {"en": "Wahan Mosdeng", "kok": "Wahan Mosdeng"}, "aliases": ["Pork salad"], "states": ["tripura"], "category": "main", "serving_g": 100, "nutrition": {"calories": 220, "protein": 18.0, "carbs": 2.0, "fat": 15.0, "fiber": 1.0}, "metadata": {"source": "Institutional", "source_reference": "Regional Study", "source_reliability": "community"}},
  {"id": "gudok", "names": {"en": "Gudok", "kok": "Gudok"}, "aliases": ["Vegetable mash"], "states": ["tripura"], "category": "side", "serving_g": 150, "nutrition": {"calories": 70, "protein": 2.0, "carbs": 12.0, "fat": 1.0, "fiber": 3.0}, "metadata": {"source": "Institutional", "source_reference": "Regional Study", "source_reliability": "community"}},
  {"id": "khundrupui", "names": {"en": "Khundrupui", "kok": "Khundrupui"}, "aliases": ["Leafy vegetable dish"], "states": ["tripura"], "category": "side", "serving_g": 100, "nutrition": {"calories": 40, "protein": 2.0, "carbs": 6.0, "fat": 0.5, "fiber": 3.0}, "metadata": {"source": "Institutional", "source_reference": "Regional Study", "source_reliability": "community"}},
  {"id": "batore", "names": {"en": "Batore", "kok": "Batore"}, "aliases": ["Rice flour bread"], "states": ["tripura"], "category": "breakfast", "serving_g": 50, "nutrition": {"calories": 150, "protein": 2.0, "carbs": 30.0, "fat": 2.0, "fiber": 1.0}, "metadata": {"source": "Institutional", "source_reference": "Regional Study", "source_reliability": "community"}},
  {"id": "chakhwi-stew", "names": {"en": "Chakhwi Stew", "kok": "Chakhwi"}, "aliases": ["Stew"], "states": ["tripura"], "category": "main", "serving_g": 100, "nutrition": {"calories": 90, "protein": 2.5, "carbs": 17.5, "fat": 1.0, "fiber": 2.0}, "metadata": {"source": "Institutional", "source_reference": "Regional Study", "source_reliability": "community"}},
  {"id": "muya-awandru-curry", "names": {"en": "Muya Awandru Curry", "kok": "Muya Awandru"}, "aliases": ["Curry"], "states": ["tripura"], "category": "side", "serving_g": 75, "nutrition": {"calories": 30, "protein": 1.0, "carbs": 5.0, "fat": 0.5, "fiber": 1.5}, "metadata": {"source": "Institutional", "source_reference": "Regional Study", "source_reliability": "community"}},
  {"id": "mosdeng-serma-side", "names": {"en": "Mosdeng Serma Side", "kok": "Mosdeng Serma"}, "aliases": ["Chutney"], "states": ["tripura"], "category": "side", "serving_g": 25, "nutrition": {"calories": 15, "protein": 0.5, "carbs": 2.5, "fat": 0.25, "fiber": 0.75}, "metadata": {"source": "Institutional", "source_reference": "Regional Study", "source_reliability": "community"}},
  {"id": "wahan-mosdeng-main", "names": {"en": "Wahan Mosdeng Main", "kok": "Wahan Mosdeng"}, "aliases": ["Main"], "states": ["tripura"], "category": "main", "serving_g": 50, "nutrition": {"calories": 110, "protein": 9.0, "carbs": 1.0, "fat": 7.5, "fiber": 0.5}, "metadata": {"source": "Institutional", "source_reference": "Regional Study", "source_reliability": "community"}},
  {"id": "gudok-side", "names": {"en": "Gudok Side", "kok": "Gudok"}, "aliases": ["Side"], "states": ["tripura"], "category": "side", "serving_g": 75, "nutrition": {"calories": 35, "protein": 1.0, "carbs": 6.0, "fat": 0.5, "fiber": 1.5}, "metadata": {"source": "Institutional", "source_reference": "Regional Study", "source_reliability": "community"}},
  {"id": "khundrupui-side", "names": {"en": "Khundrupui Side", "kok": "Khundrupui"}, "aliases": ["Side"], "states": ["tripura"], "category": "side", "serving_g": 50, "nutrition": {"calories": 20, "protein": 1.0, "carbs": 4.0, "fat": 0.25, "fiber": 1.5}, "metadata": {"source": "Institutional", "source_reference": "Regional Study", "source_reliability": "community"}},
  {"id": "batore-breakfast", "names": {"en": "Batore Breakfast", "kok": "Batore"}, "aliases": ["Breakfast"], "states": ["tripura"], "category": "breakfast", "serving_g": 25, "nutrition": {"calories": 75, "protein": 1.0, "carbs": 15.0, "fat": 1.0, "fiber": 0.5}, "metadata": {"source": "Institutional", "source_reference": "Regional Study", "source_reliability": "community"}},
  {"id": "chakhwi-stew2", "names": {"en": "Chakhwi Stew2", "kok": "Chakhwi"}, "aliases": ["Stew"], "states": ["tripura"], "category": "main", "serving_g": 100, "nutrition": {"calories": 90, "protein": 2.5, "carbs": 17.5, "fat": 1.0, "fiber": 2.0}, "metadata": {"source": "Institutional", "source_reference": "Regional Study", "source_reliability": "community"}},
  {"id": "muya-awandru-curry2", "names": {"en": "Muya Awandru Curry2", "kok": "Muya Awandru"}, "aliases": ["Curry"], "states": ["tripura"], "category": "side", "serving_g": 75, "nutrition": {"calories": 30, "protein": 1.0, "carbs": 5.0, "fat": 0.5, "fiber": 1.5}, "metadata": {"source": "Institutional", "source_reference": "Regional Study", "source_reliability": "community"}},
  {"id": "mosdeng-serma-side2", "names": {"en": "Mosdeng Serma Side2", "kok": "Mosdeng Serma"}, "aliases": ["Chutney"], "states": ["tripura"], "category": "side", "serving_g": 25, "nutrition": {"calories": 15, "protein": 0.5, "carbs": 2.5, "fat": 0.25, "fiber": 0.75}, "metadata": {"source": "Institutional", "source_reference": "Regional Study", "source_reliability": "community"}},
  {"id": "wahan-mosdeng-main2", "names": {"en": "Wahan Mosdeng Main2", "kok": "Wahan Mosdeng"}, "aliases": ["Main"], "states": ["tripura"], "category": "main", "serving_g": 50, "nutrition": {"calories": 110, "protein": 9.0, "carbs": 1.0, "fat": 7.5, "fiber": 0.5}, "metadata": {"source": "Institutional", "source_reference": "Regional Study", "source_reliability": "community"}},
  {"id": "gudok-side2", "names": {"en": "Gudok Side2", "kok": "Gudok"}, "aliases": ["Side"], "states": ["tripura"], "category": "side", "serving_g": 75, "nutrition": {"calories": 35, "protein": 1.0, "carbs": 6.0, "fat": 0.5, "fiber": 1.5}, "metadata": {"source": "Institutional", "source_reference": "Regional Study", "source_reliability": "community"}},
  {"id": "khundrupui-side2", "names": {"en": "Khundrupui Side2", "kok": "Khundrupui"}, "aliases": ["Side"], "states": ["tripura"], "category": "side", "serving_g": 50, "nutrition": {"calories": 20, "protein": 1.0, "carbs": 4.0, "fat": 0.25, "fiber": 1.5}, "metadata": {"source": "Institutional", "source_reference": "Regional Study", "source_reliability": "community"}}
]
